{
  "$schema": "../../schema/fleekdash-manifest.schema.json",
  "kind": "app",
  "id": "excalidraw",
  "name": "Excalidraw",
  "description": "A full Excalidraw drawing board inside FleekDash. Sketch diagrams, wireframes and visual boards without leaving wp-admin.",
  "version": "1.1.0",
  "author": "FleekDash",
  "author_uri": "https://fleekdash.com",
  "icon": "edit",
  "category": "plugin",
  "integration_type": "standalone",
  "requires": {
    "wp": "6.5",
    "php": "8.0",
    "fleekdash": "2.6.10"
  },
  "tags": ["drawing", "editor", "reference"],
  "routes": [
    {
      "path": "excalidraw/editor",
      "title": "Excalidraw Editor",
      "component_url": "dist/pages/editor.html",
      "icon": "edit",
      "permissions": ["authenticated"],
      "sandbox_mode": "none"
    }
  ]
}
